"Story","Title","Result","Date","Stability","Duration (s)"
"Test Management Feature","Validate list items in Test Management menu","SUCCESS","2023-04-10T06:53:08.367Z[Etc/UTC]","0.0","7.94"
"Test Management Feature","Open Rename Existing Test Names page","SUCCESS","2023-04-10T06:53:16.345Z[Etc/UTC]","0.0","34.22"
"Test Management Feature","User rejects the testName updates","SUCCESS","2023-04-10T06:53:50.604Z[Etc/UTC]","0.0","16.23"
"Test Management Feature","User cancels the testName updates","SUCCESS","2023-04-10T06:54:06.872Z[Etc/UTC]","0.0","16.32"
"Test Management Feature","Add new tests","FAILURE","2023-04-10T06:54:23.228Z[Etc/UTC]","0.0","16.9"
"Test Management Feature","Verify Added new testName","SUCCESS","2023-04-10T06:54:40.168Z[Etc/UTC]","0.0","23.62"
"Test Management Feature","Modify test details","SUCCESS","2023-04-10T06:55:03.827Z[Etc/UTC]","0.0","51.4"
